id,分類,処理名,概要,操作手順,ファイル名,関連する画面名
bac-001,認証,ユーザー登録,新しいユーザーを登録する。,ユーザーがメールアドレス、パスワードを入力し、登録ボタンをクリックする。バックエンドで入力された情報が検証され、新しいユーザーアカウントがデータベースに作成される。,auth-signup.ts,SRC-001
bac-002,認証,ログイン,既存のユーザーをログインさせる。,ユーザーがメールアドレス、パスワードを入力し、ログインボタンをクリックする。バックエンドで入力された情報がデータベースと照合され、認証が成功した場合、セッションが確立される。,auth-login.ts,SRC-001
bac-003,認証,ログアウト,ログイン中のユーザーをログアウトさせる。,ユーザーがログアウトボタンをクリックする。バックエンドで現在のセッションが無効化される。,auth-logout.ts,SRC-002
bac-005,目標管理,目標の取得,既存の目標（大目標、中目標、小目標）を取得する。,カンバン画面がロードされる際に、バックエンドにリクエストが送信され、ユーザーに関連する全ての目標がデータベースから取得され、フロントエンドに返される。,goals-get.ts,SRC-002
bac-006,目標管理,目標の更新,既存の目標（大目標、中目標、小目標）を更新する。,ユーザーがカンバン画面で目標のタイトル、種類、色、ボードIDなどの情報を変更して保存する。バックエンドで変更された情報が検証され、データベース内の目標が更新される。,goals-update.ts,SRC-002
bac-007,目標管理,目標の削除,既存の目標（大目標、中目標、小目標）を削除する。,ユーザーがカンバン画面で目標の削除ボタンをクリックする。バックエンドで削除対象の目標IDが検証され、データベースから削除される。,goals-delete.ts,SRC-002
bac-008,AI連携 (オプション),AIによる目標細分化,AI (OpenAI API) を利用して、大目標から中目標・小目標を自動生成する。,ユーザーが大目標を入力し、「AI細分化」ボタンをクリックする。バックエンドでOpenAI APIにリクエストが送信され、生成された中目標・小目標の案がフロントエンドに返される。,ai-breakdown.ts,SRC-002
bac-009,ユーザー設定,ユーザー情報の更新,ユーザーのプロフィール情報（ユーザー名、パスワード、アバター画像）を更新する。,ユーザーがマイページでユーザー名、パスワード、アバター画像などの情報を変更して保存する。バックエンドで変更された情報が検証され、データベース内のユーザー情報が更新される。,user-update.ts,SRC-003