id,分類,処理名,概要,操作手順,ファイル名,関連する画面名
bac-001,認証,ユーザー登録,新しいユーザーアカウントをデータベースに登録します。,ユーザーが登録フォームにEメールとパスワードを入力し、送信します。バックエンドは入力データを検証し、重複がないか確認後、パスワードをハッシュ化してデータベースに保存します。,auth-register.ts,SRC-001 (ログイン画面)
bac-002,認証,ログイン,既存のユーザーアカウントでログインします。,ユーザーがログインフォームにEメールとパスワードを入力し、送信します。バックエンドは入力されたEメールに対応するユーザーをデータベースから検索し、ハッシュ化されたパスワードを比較して認証します。認証が成功した場合、JWTを発行します。,auth-login.ts,SRC-001 (ログイン画面)
bac-003,Todo管理,Todo作成,新しいTodoアイテムをデータベースに追加します。,"ユーザーがTodo作成フォームにTodoの内容、ステータス (To Do, In Progress, Done) などの情報を入力し、送信します。バックエンドは入力データを検証し、データベースに新しいTodoアイテムとして保存します。",todo-create.ts,SRC-002 (カンバン画面)
bac-004,Todo管理,Todo更新,既存のTodoアイテムの情報を更新します。,ユーザーがカンバン画面でTodoアイテムを編集し、変更を保存します。バックエンドは更新されたTodoのIDに基づいてデータベース内の対応するレコードを更新します。ステータス変更 (ドラッグ＆ドロップ) もこの処理で行います。,todo-update.ts,SRC-002 (カンバン画面)
bac-005,Todo管理,Todo削除,既存のTodoアイテムをデータベースから削除します。,ユーザーがカンバン画面でTodoアイテムを削除します。バックエンドはTodoのIDに基づいてデータベース内の対応するレコードを削除します。,todo-delete.ts,SRC-002 (カンバン画面)
bac-006,Todo管理,Todo一覧取得,ユーザーのTodoアイテムをデータベースから取得します。,ユーザーの認証情報に基づいて、そのユーザーに関連するTodoアイテムをデータベースから取得し、ステータスごとに分類して返します。,todo-list.ts,SRC-002 (カンバン画面)
bac-007,ユーザー設定,ユーザー情報更新,ユーザーのプロフィール情報を更新します (ユーザー名、アバター、パスワード)。,ユーザーが設定画面でプロフィール情報を編集し、保存します。バックエンドは入力データを検証し、データベース内のユーザー情報を更新します。パスワードが変更された場合は、パスワードをハッシュ化して保存します。,user-update.ts,SRC-003 (ユーザー設定画面)
bac-008,ユーザー設定,ユーザー情報取得,ユーザーのプロフィール情報を取得します。,ユーザーの認証情報に基づいて、ユーザーのプロフィール情報をデータベースから取得し、返します。,user-get.ts,SRC-003 (ユーザー設定画面)